{
  "version": "1.2",
  "generatedAt": "2026-04-20T06:56:54.711603+00:00",
  "registry": {
    "samplesFile": "datasets/registry/samples.jsonl",
    "duplicatesFile": "datasets/registry/duplicates.jsonl",
    "sessionsFile": "datasets/registry/sessions.jsonl",
    "uniqueSamples": 0,
    "duplicateSamples": 0,
    "sessions": 0,
    "lastSessionAt": null,
    "lastSampleAt": null
  },
  "contracts": {
    "session": "contracts/session_record.schema.json",
    "sample": "contracts/sample_record.schema.json",
    "manifest": "contracts/dataset_manifest.schema.json"
  },
  "datasets": [
    {
      "key": "human_club",
      "path": "datasets/processed/human_club",
      "samples": 0,
      "format": "coco",
      "duplicateFiltered": 0,
      "splitFile": "exports/splits/human_club.json",
      "split": {
        "train": 0,
        "val": 0,
        "test": 0
      }
    },
    {
      "key": "golf_ball_detection",
      "path": "datasets/processed/golf_ball_detection",
      "samples": 0,
      "format": "yolo",
      "duplicateFiltered": 0,
      "splitFile": "exports/splits/golf_ball_detection.json",
      "split": {
        "train": 0,
        "val": 0,
        "test": 0
      }
    }
  ],
  "consumers": [
    {
      "consumer": "human_club_analysis_app",
      "manifestPath": "exports/consumers/human_club_analysis_app.json",
      "domains": [
        "human_club"
      ]
    },
    {
      "consumer": "golf_ball_detection_app",
      "manifestPath": "exports/consumers/golf_ball_detection_app.json",
      "domains": [
        "golf_ball_detection"
      ]
    },
    {
      "consumer": "pitrac_feasibility_study",
      "manifestPath": "exports/consumers/pitrac_feasibility_study.json",
      "domains": [
        "human_club",
        "golf_ball_detection"
      ]
    }
  ]
}